{
  "schemaVersion": "ysclaw.root_cause_blueprint.v1",
  "blueprintId": "bp-riscv-matmul-cache-001",
  "source": {
    "agent": "agent3",
    "createdAt": "2026-05-24T03:00:00Z",
    "software": "demo-matmul",
    "testcaseIds": ["matmul-1024"]
  },
  "problem": {
    "summary": "矩阵乘法在 RISC-V 性能测试用例上出现回退。",
    "evidence": [
      "Agent1 测试用例 matmul-1024 显示运行时间变慢 18%。",
      "性能数据热点转移到内层循环地址计算。"
    ]
  },
  "rootCause": {
    "summary": "内层循环重复计算行偏移，缺少简单的强度削减。",
    "candidateFiles": ["src/matmul.c"],
    "performanceFactors": ["地址重复计算", "循环不变量工作"]
  },
  "constraints": {
    "riskLevel": "medium",
    "mustPreserve": ["数值输出", "公共 API"]
  },
  "validation": {
    "requiredTests": ["matmul-1024", "unit-matmul"],
    "regressionCommand": "agent1 patch_regression --case matmul-1024"
  }
}
